{
  "$schema": "../../schemas/arrow-data-vector-v1.schema.json",
  "schema_version": 1,
  "contract": "plenora-arrow-data-vector-v1",
  "expect": "valid",
  "computation": "accepted",
  "schema_metadata": {
    "plenora.contract.version": "1"
  },
  "fields": [
    {
      "name": "id",
      "type": "int64",
      "nullable": false,
      "metadata": {
        "plenora.field_id": "0"
      }
    },
    {
      "name": "geometry",
      "type": "binary",
      "nullable": true,
      "metadata": {
        "plenora.field_id": "1",
        "ARROW:extension:name": "geoarrow.wkb",
        "plenora.geometry.encoding": "wkb",
        "plenora.geometry.dimensions": "xy",
        "plenora.geometry.spatial_semantics": "geometry",
        "plenora.geometry.precision": "float64",
        "plenora.geometry.types_declaration": "exact",
        "plenora.geometry.types": "point",
        "plenora.geometry.crs_resolution": "resolved",
        "plenora.geometry.crs_id": "EPSG:32632",
        "plenora.geometry.crs_definition": "{\"type\":\"ProjectedCRS\",\"name\":\"WGS 84 / UTM zone 32N\",\"base_crs\":{\"name\":\"WGS 84\",\"datum\":{\"type\":\"GeodeticReferenceFrame\",\"name\":\"World Geodetic System 1984\",\"ellipsoid\":{\"name\":\"WGS 84\",\"semi_major_axis\":6378137,\"inverse_flattening\":298.257223563}},\"id\":{\"authority\":\"EPSG\",\"code\":4326}},\"id\":{\"authority\":\"EPSG\",\"code\":32632}}",
        "plenora.geometry.crs_definition_format": "projjson",
        "plenora.geometry.axis_order": "easting_northing"
      }
    }
  ],
  "rows": [
    {
      "id": 1,
      "geometry": "01010000000000000080841e4100000000ccbc5141"
    }
  ]
}
