{
  "$schema": "../../schemas/arrow-data-vector-v1.schema.json",
  "schema_version": 1,
  "contract": "plenora-arrow-data-vector-v1",
  "expect": "valid",
  "computation": {
    "category": "crs",
    "rules": [
      "GEO-015"
    ]
  },
  "schema_metadata": {
    "plenora.contract.version": "1"
  },
  "fields": [
    {
      "name": "id",
      "type": "int64",
      "nullable": false,
      "metadata": {
        "plenora.field_id": "0"
      }
    },
    {
      "name": "geometry",
      "type": "binary",
      "nullable": true,
      "metadata": {
        "plenora.field_id": "1",
        "ARROW:extension:name": "geoarrow.wkb",
        "plenora.geometry.encoding": "wkb",
        "plenora.geometry.dimensions": "xy",
        "plenora.geometry.spatial_semantics": "geometry",
        "plenora.geometry.precision": "float64",
        "plenora.geometry.types_declaration": "exact",
        "plenora.geometry.types": "point",
        "plenora.geometry.crs_resolution": "resolved",
        "plenora.geometry.crs_id": "EPSG:3003",
        "plenora.geometry.crs_definition": "PROJCS[\"Monte Mario / Italy zone 1\",GEOGCS[\"WGS 84\",DATUM[\"WGS_1984\",SPHEROID[\"WGS 84\",6378137,298.257223563,AUTHORITY[\"EPSG\",\"7030\"]],AUTHORITY[\"EPSG\",\"6326\"]],PRIMEM[\"Greenwich\",0],UNIT[\"degree\",0.0174532925199433],AUTHORITY[\"EPSG\",\"4326\"]],PROJECTION[\"Transverse_Mercator\"],PARAMETER[\"latitude_of_origin\",0],PARAMETER[\"central_meridian\",9],PARAMETER[\"scale_factor\",0.9996],PARAMETER[\"false_easting\",1500000],PARAMETER[\"false_northing\",0],UNIT[\"metre\",1],AXIS[\"Easting\",EAST],AXIS[\"Northing\",NORTH],AUTHORITY[\"EPSG\",\"3003\"]]",
        "plenora.geometry.crs_definition_format": "wkt",
        "plenora.geometry.axis_order": "easting_northing"
      }
    }
  ],
  "rows": [
    {
      "id": 1,
      "geometry": "01010000000000000099133741000000c091345341"
    }
  ]
}
