{
  "$schema": "../../schemas/arrow-data-vector-v1.schema.json",
  "schema_version": 1,
  "contract": "plenora-arrow-data-vector-v1",
  "expect": "valid",
  "computation": {
    "category": "crs",
    "rules": [
      "VOC-015"
    ]
  },
  "schema_metadata": {
    "plenora.contract.version": "1"
  },
  "fields": [
    {
      "name": "id",
      "type": "int64",
      "nullable": false,
      "metadata": {
        "plenora.field_id": "0"
      }
    },
    {
      "name": "geometry",
      "type": "binary",
      "nullable": true,
      "metadata": {
        "plenora.field_id": "1",
        "ARROW:extension:name": "geoarrow.wkb",
        "plenora.geometry.encoding": "wkb",
        "plenora.geometry.dimensions": "xy",
        "plenora.geometry.spatial_semantics": "geometry",
        "plenora.geometry.precision": "float64",
        "plenora.geometry.types_declaration": "exact",
        "plenora.geometry.types": "point",
        "plenora.geometry.crs_resolution": "resolved",
        "plenora.geometry.crs_id": "EPSG:999999",
        "plenora.geometry.axis_order": "unknown"
      }
    }
  ],
  "rows": [
    {
      "id": 1,
      "geometry": "01010000000000000000205ec00000000000a04640"
    }
  ]
}
